{
  "schema_version": 1,
  "fixture_set_id": "scrim-refusal-correction-boundary-gestures-20260430",
  "schema_ref": "schemas/scrim-refusal-correction-boundary-gestures.schema.json",
  "generated_from": [
    "spec:2026-04-29-scrim-programme-director-behavior-contract",
    "spec:2026-04-29-programme-world-surface-integration-plan",
    "docs/superpowers/specs/2026-04-29-programme-boundary-event-surface-design.md",
    "shared/content_programme_run_store.py",
    "shared/scrim_wcs_claim_posture.py",
    "shared/director_scrim_gesture_adapter.py"
  ],
  "declared_at": "2026-04-30T06:32:00Z",
  "producer": "cx-amber",
  "boundary_postures": [
    "refusal",
    "correction",
    "uncertainty",
    "stale_source",
    "rights_blocked",
    "privacy_blocked",
    "monetization_held",
    "public_event_held"
  ],
  "fail_closed_policy": {
    "scrim_grants_truth": false,
    "scrim_grants_rights": false,
    "scrim_grants_safety": false,
    "scrim_grants_public_status": false,
    "scrim_grants_monetization_status": false,
    "scrim_implies_public_fanout": false,
    "aesthetic_emphasis_validates_blocked_claim": false,
    "private_blocked_details_can_be_foregrounded": false
  },
  "fixtures": [
    {
      "fixture_id": "public_safe_refusal_success",
      "family": "refusal",
      "boundary_event": {
        "schema_version": 1,
        "boundary_id": "pbe:refusal-public-safe",
        "emitted_at": "2026-04-30T06:32:01Z",
        "programme_id": "programme:refusal-breakdown",
        "run_id": "run:refusal-public-safe",
        "format_id": "refusal_breakdown",
        "sequence": 4,
        "boundary_type": "refusal.issued",
        "public_private_mode": "public_archive",
        "summary": "Unsupported claim converted into a public-safe refusal artifact.",
        "evidence_refs": ["evidence:format-refusal:unsupported-claim"],
        "no_expert_system_gate": {
          "gate_ref": "gate:no-expert-system:refusal-public-safe",
          "gate_state": "refusal",
          "claim_allowed": false,
          "public_claim_allowed": false,
          "infractions": []
        },
        "claim_shape": {
          "claim_kind": "refusal",
          "authority_ceiling": "evidence_bound",
          "confidence_label": "none",
          "uncertainty": "Claim refused; no answer asserted.",
          "scope_limit": "Refusal artifact only."
        },
        "public_event_mapping": {
          "internal_only": false,
          "fallback_action": "archive_only",
          "unavailable_reasons": []
        },
        "dry_run_unavailable_reasons": [],
        "duplicate_key": "programme:run:refusal-public-safe:004"
      },
      "wcs_source_refs": ["wcs:boundary:refusal-public-safe", "scrim-wcs-posture:refusal"],
      "source_refs": ["content-programme-run:run:refusal-public-safe"],
      "run_store_ref": "content-programme-run-store:run:refusal-public-safe:boundary:004",
      "audit_log_ref": "audit:scrim-boundary:refusal-public-safe",
      "health_ref": "health:scrim.visual.nominal",
      "target_region_refs": ["region:programme.primary"],
      "requested_intensity": 0.52,
      "expected": {
        "posture": "refusal",
        "visual_treatment": "foreground_public_safe_artifact",
        "scrim_state_gesture_type": "refusal_dim",
        "artifact_visibility": "foreground_public_safe",
        "programme_output_success": true,
        "public_safe_artifact": true,
        "reason_code": "public_safe_refusal_artifact"
      }
    },
    {
      "fixture_id": "public_safe_correction_success",
      "family": "correction",
      "boundary_event": {
        "schema_version": 1,
        "boundary_id": "pbe:correction-public-safe",
        "emitted_at": "2026-04-30T06:32:02Z",
        "programme_id": "programme:evidence-audit",
        "run_id": "run:correction-public-safe",
        "format_id": "evidence_audit",
        "sequence": 5,
        "boundary_type": "correction.made",
        "public_private_mode": "public_archive",
        "summary": "Correction artifact replaces an earlier public-safe error.",
        "evidence_refs": ["evidence:correction:source-ledger"],
        "no_expert_system_gate": {
          "gate_ref": "gate:no-expert-system:correction-public-safe",
          "gate_state": "correction_required",
          "claim_allowed": false,
          "public_claim_allowed": false,
          "infractions": []
        },
        "claim_shape": {
          "claim_kind": "correction",
          "authority_ceiling": "evidence_bound",
          "confidence_label": "none",
          "uncertainty": "Correction cites source ledger rather than new authority.",
          "scope_limit": "Correction artifact only."
        },
        "public_event_mapping": {
          "internal_only": false,
          "fallback_action": "archive_only",
          "unavailable_reasons": []
        },
        "dry_run_unavailable_reasons": [],
        "duplicate_key": "programme:run:correction-public-safe:005"
      },
      "wcs_source_refs": ["wcs:boundary:correction-public-safe", "scrim-wcs-posture:correction"],
      "source_refs": ["content-programme-run:run:correction-public-safe"],
      "run_store_ref": "content-programme-run-store:run:correction-public-safe:boundary:005",
      "audit_log_ref": "audit:scrim-boundary:correction-public-safe",
      "health_ref": "health:scrim.visual.nominal",
      "target_region_refs": ["region:programme.primary"],
      "requested_intensity": 0.58,
      "expected": {
        "posture": "correction",
        "visual_treatment": "foreground_public_safe_artifact",
        "scrim_state_gesture_type": "correction_glint",
        "artifact_visibility": "foreground_public_safe",
        "programme_output_success": true,
        "public_safe_artifact": true,
        "reason_code": "public_safe_correction_artifact"
      }
    },
    {
      "fixture_id": "uncertainty_local_clarity",
      "family": "uncertainty",
      "boundary_event": {
        "schema_version": 1,
        "boundary_id": "pbe:uncertainty-local",
        "emitted_at": "2026-04-30T06:32:03Z",
        "programme_id": "programme:comparison",
        "run_id": "run:uncertainty-local",
        "format_id": "comparison",
        "sequence": 6,
        "boundary_type": "uncertainty.marked",
        "public_private_mode": "public_archive",
        "summary": "Boundary marks uncertainty without strengthening the claim.",
        "evidence_refs": ["evidence:comparison:partial"],
        "no_expert_system_gate": {
          "gate_ref": "gate:no-expert-system:uncertainty-local",
          "gate_state": "pass",
          "claim_allowed": true,
          "public_claim_allowed": true,
          "infractions": []
        },
        "claim_shape": {
          "claim_kind": "comparison",
          "authority_ceiling": "speculative",
          "confidence_label": "low",
          "uncertainty": "Evidence is partial and marked as uncertain.",
          "scope_limit": "Comparison remains bounded to cited evidence."
        },
        "public_event_mapping": {
          "internal_only": false,
          "fallback_action": "archive_only",
          "unavailable_reasons": []
        },
        "dry_run_unavailable_reasons": [],
        "duplicate_key": "programme:run:uncertainty-local:006"
      },
      "wcs_source_refs": ["wcs:boundary:uncertainty-local", "scrim-wcs-posture:uncertain"],
      "source_refs": ["content-programme-run:run:uncertainty-local"],
      "run_store_ref": "content-programme-run-store:run:uncertainty-local:boundary:006",
      "audit_log_ref": "audit:scrim-boundary:uncertainty-local",
      "health_ref": "health:scrim.visual.nominal",
      "target_region_refs": ["region:programme.primary"],
      "requested_intensity": 0.36,
      "expected": {
        "posture": "uncertainty",
        "visual_treatment": "local_clarity_shift",
        "scrim_state_gesture_type": "shimmer",
        "artifact_visibility": "none",
        "programme_output_success": false,
        "public_safe_artifact": false,
        "reason_code": "uncertainty"
      }
    },
    {
      "fixture_id": "stale_source_holds_last_safe",
      "family": "stale_source",
      "boundary_event": {
        "schema_version": 1,
        "boundary_id": "pbe:stale-source",
        "emitted_at": "2026-04-30T06:32:04Z",
        "programme_id": "programme:ranking",
        "run_id": "run:stale-source",
        "format_id": "ranking",
        "sequence": 7,
        "boundary_type": "uncertainty.marked",
        "public_private_mode": "public_archive",
        "summary": "Boundary holds because the source is stale.",
        "evidence_refs": ["evidence:ranking:stale-source"],
        "no_expert_system_gate": {
          "gate_ref": "gate:no-expert-system:stale-source",
          "gate_state": "dry_run",
          "claim_allowed": false,
          "public_claim_allowed": false,
          "infractions": ["source_stale"]
        },
        "claim_shape": {
          "claim_kind": "ranking",
          "authority_ceiling": "speculative",
          "confidence_label": "low",
          "uncertainty": "Source has expired.",
          "scope_limit": "Dry-run ranking only."
        },
        "public_event_mapping": {
          "internal_only": false,
          "fallback_action": "hold",
          "unavailable_reasons": ["source_stale"]
        },
        "dry_run_unavailable_reasons": ["source_stale"],
        "duplicate_key": "programme:run:stale-source:007"
      },
      "wcs_source_refs": ["wcs:boundary:stale-source", "scrim-wcs-posture:stale"],
      "source_refs": ["content-programme-run:run:stale-source"],
      "run_store_ref": "content-programme-run-store:run:stale-source:boundary:007",
      "audit_log_ref": "audit:scrim-boundary:stale-source",
      "health_ref": "health:scrim.visual.stale",
      "target_region_refs": ["region:programme.primary"],
      "requested_intensity": 0.61,
      "expected": {
        "posture": "stale_source",